{"agentId":"agent_child","endedAt":"2026-08-10T09:00:00.000Z","errors":[],"eventCount":4,"firstSequence":1,"gaps":["post-tool effect observation was unavailable","post-tool effect observation was unavailable","post-tool effect observation was unavailable","post-tool effect observation was unavailable"],"lastSequence":4,"parentRunId":"run_parent","parentTaskId":"task_parent","recorderVersion":"0.1.0","runId":"run_child","schemaVersion":1,"startedAt":"2026-08-10T09:00:00.000Z","status":"succeeded","taskId":"task_child","traceDigest":"sha256:4280c4b13a35ac5d6d1d8862a15c715d4b94f70c872eefa902c90806eee494a5","worktreeId":"worktree_child"}
