{"agentId":"agent_parent","endedAt":"2026-08-10T09:00:00.000Z","errors":[],"eventCount":5,"firstSequence":1,"gaps":["post-tool effect observation was unavailable","post-tool effect observation was unavailable","post-tool effect observation was unavailable","post-tool effect observation was unavailable","post-tool effect observation was unavailable"],"lastSequence":5,"parentRunId":null,"parentTaskId":null,"recorderVersion":"0.1.0","runId":"run_parent","schemaVersion":1,"startedAt":"2026-08-10T09:00:00.000Z","status":"succeeded","taskId":"task_parent","traceDigest":"sha256:c3a07920731d817d9b16506ad17731f0f74a7046a3b717dd99d9347ae9073b40","worktreeId":"worktree_parent"}
